{
  "$schema": "https://json-schema.org/draft/2020-12/schema",
  "title": "lobid-resources",
  "description": "This is a generic JSON schema for validating a JSON document against the lobid-resources data model",
  "type": "object",
  "additionalProperties": false,
  "properties": {
    "@context": {
      "$ref": "context.json"
    },
    "id": {
      "$ref": "id.json"
    },
    "type": {
      "$ref": "type.json"
    },
    "abstract": {
      "title": "Abstract",
      "type": "array"
    },
    "accessRights": {
      "$ref": "accessRights.json"
    },
    "almaMmsId": {
      "title": "ALMA MMS identifier",
      "type": "string",
      "pattern": "^\\A99\\d{10,}\\z$"
    },
    "alternateGraphicRepresentation": {
      "$ref": "alternateGraphicRepresentation.json"
    },
    "alternativeTitle": {
      "title": "Variations of the title",
      "type": "array",
      "items": {
        "type": "string"
      }
    },
    "bvbId": {
      "title": "B3Kat identifier",
      "type": "string",
      "pattern": "^BV\\d{9}$"
    },
    "bibliographicCitation": {
      "type": "string"
    },
    "bibliographicLevel": {
      "$ref": "bibliographicLevel.json"
    },
    "bszId": {
      "title": "bsz identifier",
      "type": "string"
    },
    "conditionsOfAccess": {
      "$ref": "conditionsOfAccess.json"
    },
    "containedIn": {
      "$ref": "containedIn.json"
    },
    "containsExampleOfWork": {
      "$ref": "containsExampleOfWork.json"
    },
    "contribution": {
      "$ref": "contribution.json"
    },
    "describedBy": {
      "$ref": "describedBy.json"
    },
    "deprecatedUri": {
      "$ref": "id.json"
    },
    "description": {
      "$ref": "description.json"
    },
    "disambiguatingDescription": {
      "title": "Dynamic helper element for deduplicating efforts.",
      "type": "array",
      "items": {
        "type": "string"
      }
    },
    "dnbId": {
      "title": "DNB identifier",
      "type": "string",
      "pattern": "^\\d{8,9}[X\\d]?$"
    },
    "doi": {
      "$ref": "doi.json"
    },
    "edition": {
      "title": "Statement on the edition of the resource",
      "type": "array",
      "items": {
        "type": "string"
      }
    },
    "exampleOfWork": {
      "$ref": "exampleOfWork.json"
    },
    "extent": {
      "title": "Extent",
      "type": "string"
    },
    "fulltextOnline": {
      "$ref": "fulltextOnline.json"
    },
    "gbvId": {
      "title": "gbv identifier",
      "type": "string"
    },
    "hasItem": {
      "$ref": "hasItem.json"
    },
    "hbzId": {
      "title": "hbz identifier",
      "type": "string",
      "pattern": "^[BCHT]T\\d+$"
    },
    "hebisId": {
      "title": "hebis PPN identifier",
      "type": "string",
      "pattern": "^\\d{9,10}$"
    },
    "inCollection": {
      "$ref": "inCollection.json"
    },
    "isPartOf": {
      "$ref": "isPartOf.json"
    },
    "isbn": {
      "$ref": "isbn.json"
    },
    "issn": {
      "$ref": "issn.json"
    },
    "ismn": {
      "$ref": "ismn.json"
    },
    "kobvId": {
      "title": "kobv identifier",
      "type": "string"
    },
    "k10PlusId": {
      "title": "K10Plus identifier",
      "type": "string",
      "pattern": "^\\d{8,9}[0-9X]$"
    },
    "langNote": {
      "title": "Note concerning the language of a resource",
      "type": "array",
      "items": {
        "type": "string"
      }
    },
    "language": {
      "$ref": "language.json"
    },
    "license": {
      "$ref": "license.json"
    },
    "manufacture": {
      "$ref": "manufacture.json"
    },
    "medium": {
      "$ref": "medium.json"
    },
    "natureOfContent": {
      "$ref": "natureOfContent.json"
    },
    "note": {
      "$ref": "note.json"
    },
    "obvId": {
      "title": "OBV identifier",
      "type": "string",
      "pattern": "^AC[\\d]{8}$"
    },
    "oclcNumber": {
      "title": "OCLC number",
      "description": "The OCLC number of the resource",
      "type": "array",
      "items": {
        "type": "string",
        "pattern": "^\\d{1,14}$"
      }
    },
    "otherTitleInformation": {
      "title": "Additional title information",
      "type": "array",
      "items": {
        "type": "string"
      }
    },
    "predecessor": {
      "$ref": "predecessor.json"
    },
    "primaryForm": {
      "$ref": "primaryForm.json"
    },
    "publication": {
      "$ref": "publication.json"
    },
    "related": {
      "$ref": "related.json"
    },
    "responsibilityStatement": {
      "title": "Responsibility Statement",
      "type": "array",
      "items": {
        "type": "string"
      }
    },
    "rpbId": {
      "title": "RPB identifier",
      "type": "string"
    },
    "sameAs": {
      "$ref": "sameAs.json"
    },
    "secondaryForm": {
      "$ref": "secondaryForm.json"
    },
    "seeAlso": {
      "$ref": "seeAlso.json"
    },
    "shortTitle": {
      "title": "Short version of title",
      "type": "array",
      "items": {
        "type": "string"
      }
    },
    "spatial": {
      "$ref": "spatial.json"
    },
    "stockNumber": {
      "title": "Product identifier from retail or publisher",
      "type": "array",
      "items": {
        "type": "string"
      }
    },
    "subject": {
      "title": "Subject",
      "description": "Subject indexing of the resource",
      "type": "array",
      "items": {
        "anyOf": [
          {
            "$ref": "complexSubject.json"
          },
          {
            "$ref": "skosConcept.json"
          }
        ]
      }
    },
    "subjectAltLabel": {
      "title": "Alternative labels for subjects",
      "type": "array",
      "items": {
        "type": "string"
      }
    },
    "subjectslabels": {
      "title": "Labels for all subjects needed by Digibib",
      "type": "array",
      "items": {
        "type": "string"
      }
    },
    "successor": {
      "$ref": "successor.json"
    },
    "supplement": {
      "$ref": "supplement.json"
    },
    "tableOfContents": {
      "$ref": "tableOfContents.json"
    },
    "thesisInformation": {
      "title": "Information specific to the doctoral thesis",
      "type": "array",
      "items": {
        "type": "string"
      }
    },
    "title": {
      "title": "Title",
      "type": "string"
    },
    "titleKeyword": {
      "title": "Keywords taken from the title",
      "type": "array",
      "items": {
        "type": "string"
      }
    },
    "urn": {
      "title": "urn",
      "description": "urn of the resource",
      "type": "array",
      "items": {
        "type": "string"
      }
    },
    "webPageArchived": {
      "$ref": "webPageArchived.json"
    },
    "zdbId": {
      "title": "ZDB identifier",
      "type": "string",
      "pattern": "^\\d{1,7}-[Xx\\d]$"
    }
  },
  "required": [
    "@context",
    "id",
    "type"
  ]
}
