{
  "type" : [ "Book", "BibliographicResource" ],
  "contribution" : [ {
    "type" : [ "Contribution" ],
    "agent" : {
      "id" : "https://d-nb.info/gnd/1108328849",
      "type" : [ "Person" ],
      "label" : "Boeszoermeny, Louisa",
      "dateOfBirth" : "1991",
      "gndIdentifier" : "1108328849"
    },
    "role" : {
      "id" : "http://id.loc.gov/vocabulary/relators/pht",
      "label" : "Fotografie"
    }
  }, {
    "type" : [ "Contribution" ],
    "agent" : {
      "id" : "https://d-nb.info/gnd/1067217789",
      "type" : [ "Person" ],
      "label" : "Ganslmeier, Jakob",
      "dateOfBirth" : "1990",
      "gndIdentifier" : "1067217789"
    },
    "role" : {
      "id" : "http://id.loc.gov/vocabulary/relators/pht",
      "label" : "Fotografie"
    }
  }, {
    "type" : [ "Contribution" ],
    "agent" : {
      "id" : "https://d-nb.info/gnd/10057549-3",
      "type" : [ "CorporateBody" ],
      "label" : "Kultur Ruhr GmbH",
      "gndIdentifier" : "10057549-3"
    },
    "role" : {
      "id" : "http://id.loc.gov/vocabulary/relators/ctb",
      "label" : "Beitragende/r"
    }
  }, {
    "type" : [ "Contribution" ],
    "agent" : {
      "id" : "https://d-nb.info/gnd/5555595-0",
      "type" : [ "ConferenceOrEvent" ],
      "label" : "Ruhrtriennale",
      "altLabel" : "Ruhr-Triennale",
      "gndIdentifier" : "5555595-0"
    },
    "role" : {
      "id" : "http://id.loc.gov/vocabulary/relators/ctb",
      "label" : "Beitragende/r"
    }
  } ],
  "extent" : "[110] S. : zahlr. Ill., überw. farb.",
  "hasItem" : [ {
    "id" : "http://lobid.org/items/HT019093814:DE-Kn3:KMB%2FYF%20DEUTSC%20%202016%20A#!",
    "type" : [ "Item" ],
    "heldBy" : {
      "id" : "http://lobid.org/organisations/DE-Kn3#!",
      "label" : "lobid Organisation"
    },
    "note" : [ "00020050" ],
    "callNumber" : "KMB/YF DEUTSC  2016 A",
    "label" : "KMB/YF DEUTSC  2016 A"
  }, {
    "id" : "http://lobid.org/items/HT019093814:DE-465:JZH43391#!",
    "type" : [ "Item" ],
    "heldBy" : {
      "id" : "http://lobid.org/organisations/DE-465#!",
      "label" : "lobid Organisation"
    },
    "note" : [ "E11" ],
    "callNumber" : "JZH43391",
    "label" : "JZH43391"
  }, {
    "id" : "http://lobid.org/items/HT019093814:DE-Bm3-3:A%2012%20647#!",
    "type" : [ "Item" ],
    "heldBy" : {
      "id" : "http://lobid.org/organisations/DE-Bm3-3#!",
      "label" : "lobid Organisation"
    },
    "note" : [ "K02" ],
    "callNumber" : "A 12 647",
    "label" : "A 12 647"
  }, {
    "id" : "http://lobid.org/items/HT019093814:DE-6:LC%201017#!",
    "type" : [ "Item" ],
    "heldBy" : {
      "id" : "http://lobid.org/organisations/DE-6#!",
      "label" : "lobid Organisation"
    },
    "callNumber" : "LC 1017",
    "label" : "LC 1017"
  } ],
  "note" : [ "Wendebuch" ],
  "alternativeTitle" : [ "Licht unserer Tage", "Bude Bett Bargeld" ],
  "language" : [ {
    "id" : "http://id.loc.gov/vocabulary/iso639-2/deu",
    "label" : "Deutsch"
  }, {
    "id" : "http://id.loc.gov/vocabulary/iso639-2/eng",
    "label" : "Englisch"
  } ],
  "medium" : [ {
    "id" : "http://rdaregistry.info/termList/RDAproductionMethod/1010",
    "label" : "Print"
  } ],
  "spatial" : [ {
    "id" : "https://nwbib.de/spatial#N20",
    "type" : [ "Concept" ],
    "source" : {
      "id" : "https://nwbib.de/spatial",
      "label" : "Raumsystematik der Nordrhein-Westfälischen Bibliographie"
    },
    "label" : "Ruhrgebiet",
    "notation" : "20",
    "focus" : {
      "id" : "http://www.wikidata.org/entity/Q151993",
      "type" : [ "http://www.wikidata.org/entity/Q245260" ],
      "geo" : {
        "lat" : "51.5",
        "lon" : "7.5"
      },
      "label" : "Ruhrgebiet"
    }
  } ],
  "subject" : [ {
    "type" : [ "ComplexSubject" ],
    "componentList" : [ {
      "id" : "https://d-nb.info/gnd/1063656419",
      "type" : [ "ConferenceOrEvent" ],
      "source" : {
        "id" : "https://d-nb.info/gnd/7749153-1",
        "label" : "Gemeinsame Normdatei (GND)"
      },
      "label" : "Ruhrtriennale (2015-2017 : Nordrhein-Westfalen)",
      "gndIdentifier" : "1063656419"
    }, {
      "id" : "https://d-nb.info/gnd/4045895-7",
      "type" : [ "SubjectHeading" ],
      "source" : {
        "id" : "https://d-nb.info/gnd/7749153-1",
        "label" : "Gemeinsame Normdatei (GND)"
      },
      "label" : "Fotografie",
      "gndIdentifier" : "4045895-7"
    } ],
    "label" : "Ruhrtriennale (2015-2017), Nordrhein-Westfalen | Fotografie"
  }, {
    "id" : "https://nwbib.de/subjects#N848000",
    "source" : {
      "id" : "https://nwbib.de/subjects",
      "label" : "Sachsystematik der Nordrhein-Westfälischen Bibliographie"
    },
    "notation" : "848000",
    "label" : "Photographie"
  }, {
    "id" : "https://nwbib.de/subjects#N841060",
    "source" : {
      "id" : "https://nwbib.de/subjects",
      "label" : "Sachsystematik der Nordrhein-Westfälischen Bibliographie"
    },
    "notation" : "841060",
    "label" : "Kunstausstellungen"
  } ],
  "title" : "Bude Bett Bargeld / Licht unserer Tage",
  "hbzId" : "HT019093814",
  "inCollection" : [ {
    "id" : "http://lobid.org/resources/HT014176012#!",
    "type" : [ "Collection" ],
    "label" : "Nordrhein-Westfälische Bibliographie (NWBib)"
  } ],
  "subjectAltLabel" : [ "Lichtbild (Fotographie)", "Lichtbild (Photographie)", "Photographieren", "Photografie", "Nordrhein-Westfalen (Nordrhein-Westfalen)", "Fotografische Aufnahme", "Foto", "Lichtbild (Photografie)", "Fotoaufnahme", "Aufnahme (Fotografie)", "Photo", "Fotografieren", "Aufnahme (Photografie)", "Fotographie", "Lichtbild (Fotografie)", "Photografieren", "Photoaufnahme", "Photografische Aufnahme", "Photographische Aufnahme", "Photokunst", "Fotographieren", "Fotokunst", "Aufnahme (Photographie)", "Photographie", "Aufnahme (Fotographie)", "Fotographische Aufnahme" ],
  "edition" : [ "[1. Auflage]" ],
  "isbn" : [ "9783954761586" ],
  "oclcNumber" : [ "1076073898" ],
  "otherTitleInformation" : [ "junge Fotografie, Ruhrtriennale 2016 : Meisterkurse Daniel Josefson und Julian Römer; Louisa Boeszoermeny, Jakob Ganslmeier, Gregro Schmidt, Julian Slagman" ],
  "natureOfContent" : [ {
    "id" : "https://d-nb.info/gnd/1071861417",
    "label" : "Konferenzschrift"
  } ],
  "publication" : [ {
    "type" : [ "PublicationEvent" ],
    "location" : "Berlin",
    "publishedBy" : "Distanz",
    "startDate" : "2016"
  } ],
  "sameAs" : [ {
    "id" : "http://worldcat.org/oclc/1076073898",
    "label" : "1076073898"
  }, {
    "id" : "http://hub.culturegraph.org/resource/HBZ-HT019093814",
    "label" : "Culturegraph Ressource"
  } ],
  "describedBy" : {
    "id" : "http://lobid.org/resources/HT019093814",
    "type" : [ "BibliographicDescription" ],
    "modifiedBy" : {
      "id" : "http://lobid.org/organisations/DE-Kn3#!",
      "label" : "lobid Organisation"
    },
    "dateCreated" : "20160915",
    "dateModified" : "20210409",
    "inDataset" : {
      "id" : "http://lobid.org/resources/dataset#!",
      "label" : "lobid-resources – Der hbz-Verbundkatalog als Linked Open Data"
    },
    "resultOf" : {
      "type" : [ "CreateAction" ],
      "endTime" : "2023-04-16T02:40:19",
      "instrument" : {
        "id" : "https://github.com/hbz/lobid-resources",
        "type" : [ "SoftwareApplication" ],
        "label" : "Software lobid-resources"
      },
      "object" : {
        "id" : "http://lobid.org/hbz01/HT019093814",
        "type" : [ "DataFeedItem" ],
        "inDataset" : {
          "id" : "https://datahub.io/dataset/hbz_unioncatalog",
          "label" : "hbz_unioncatalog"
        },
        "label" : "hbz-Ressource HT019093814 im Exportformat MAB2-XML"
      }
    },
    "license" : [ {
      "id" : "http://creativecommons.org/publicdomain/zero/1.0",
      "label" : "Creative Commons-Lizenz CC0 1.0 Universal"
    } ],
    "sourceOrganization" : {
      "id" : "http://lobid.org/organisations/DE-Kn3#!",
      "label" : "lobid Organisation"
    },
    "label" : "Webseite der hbz-Ressource HT019093814"
  },
  "@context" : "http://lobid.org/resources/context.jsonld",
  "id" : "http://lobid.org/resources/HT019093814#!"
}