{
  "@context" : "http://lobid.org/resources/context.jsonld",
  "almaMmsId" : "990194515170206441",
  "hbzId" : "HT017536715",
  "title" : "Die Evangelische Kirche im Wandel",
  "otherTitleInformation" : [ "Luthers Erben an der Ruhr" ],
  "responsibilityStatement" : [ "Thomas Emons" ],
  "publication" : [ {
    "publicationHistory" : "2012",
    "startDate" : "2012",
    "type" : [ "PublicationEvent" ]
  } ],
  "hasItem" : [ {
    "heldBy" : {
      "id" : "http://lobid.org/organisations/DE-605#!",
      "label" : "lobid Organisation"
    },
    "id" : "https://lobid.org/item/990194515170206441",
    "type" : [ "MBD" ],
    "label" : "990194515170206441"
  } ],
  "type" : [ "Book", "BibliographicResource" ],
  "language" : [ {
    "label" : "Deutsch",
    "id" : "http://id.loc.gov/vocabulary/iso639-2/ger"
  } ],
  "sameAs" : [ {
    "id" : "http://hub.culturegraph.org/resource/HBZ-HT017536715",
    "label" : "Culturegraph Ressource"
  } ],
  "isPartOf" : [ {
    "type" : "IsPartOfRelation",
    "hasSuperordinate" : [ {
      "label" : "Jahrbuch / Mülheim an der Ruhr",
      "id" : "http://lobid.org/resources/HT006816401#!"
    } ]
  } ],
  "inCollection" : [ {
    "label" : "Nordrhein-Westfälische Bibliographie (NWBib)",
    "id" : "http://lobid.org/resources/HT014176012#!",
    "type" : [ "Collection" ]
  }, {
    "id" : "https://lobid.org/collections#NWBib-61",
    "type" : [ "Collection" ],
    "label" : "collections#NWBib-61"
  } ],
  "contribution" : [ {
    "type" : [ "Contribution" ],
    "agent" : {
      "label" : "Emons, Thomas",
      "type" : [ "Person" ],
      "gndIdentifier" : "129424323",
      "id" : "https://d-nb.info/gnd/129424323"
    },
    "role" : {
      "id" : "http://id.loc.gov/vocabulary/relators/aut",
      "label" : "Autor/in"
    }
  } ],
  "describedBy" : {
    "id" : "http://lobid.org/resources/990194515170206441",
    "label" : "Webseite der hbz-Ressource 990194515170206441",
    "type" : [ "BibliographicDescription" ],
    "inDataset" : {
      "id" : "http://lobid.org/resources/dataset#!",
      "label" : "lobid-resources – Der hbz-Verbundkatalog als Linked Open Data"
    },
    "license" : [ {
      "id" : "http://creativecommons.org/publicdomain/zero/1.0",
      "label" : "Creative Commons-Lizenz CC0 1.0 Universal"
    } ],
    "sourceOrganization" : {
      "id" : "http://lobid.org/organisations/DE-Bm 3#!",
      "label" : "lobid Organisation"
    },
    "modifiedBy" : {
      "id" : "http://lobid.org/organisations/DE-61#!",
      "label" : "lobid Organisation"
    },
    "dateModified" : "20210731",
    "dateCreated" : "20210405",
    "resultOf" : {
      "type" : [ "CreateAction" ],
      "instrument" : {
        "id" : "https://github.com/hbz/lobid-resources",
        "type" : [ "SoftwareApplication" ],
        "label" : "Software lobid-resources"
      },
      "object" : {
        "id" : "http://lobid.org/hbz01/990194515170206441",
        "type" : [ "DataFeedItem" ],
        "label" : "hbz-Ressource 990194515170206441 im Exportformat MARC21 XML",
        "inDataset" : {
          "id" : "https://datahub.io/dataset/hbz_unioncatalog",
          "label" : "hbz_unioncatalog"
        }
      },
      "endTime" : "dummy"
    }
  },
  "subject" : [ {
    "type" : [ "ComplexSubject" ],
    "label" : "Mülheim an der Ruhr | Evangelische Kirche im Rheinland | Geschichte",
    "componentList" : [ {
      "label" : "Mülheim an der Ruhr",
      "type" : [ "PlaceOrGeographicName" ],
      "id" : "http://d-nb.info/gnd/4040475-4",
      "source" : {
        "id" : "https://d-nb.info/gnd/7749153-1",
        "label" : "Gemeinsame Normdatei (GND)"
      },
      "gndIdentifier" : "4040475-4"
    }, {
      "label" : "Evangelische Kirche im Rheinland",
      "type" : [ "CorporateBody" ],
      "id" : "http://d-nb.info/gnd/1183319010",
      "source" : {
        "id" : "https://d-nb.info/gnd/7749153-1",
        "label" : "Gemeinsame Normdatei (GND)"
      },
      "gndIdentifier" : "1183319010"
    }, {
      "label" : "Geschichte"
    } ]
  } ],
  "subjectAltLabel" : [ "Mülheim, Ruhr", "Mülheim", "Mülheim a. d. Ruhr" ],
  "id" : "http://lobid.org/resources/990194515170206441#!"
}
