{
  "type" : [ "Book", "BibliographicResource" ],
  "contribution" : [ {
    "type" : [ "Contribution" ],
    "agent" : {
      "type" : [ "Person" ],
      "label" : "Waltershausen, Hermann W. von"
    },
    "role" : {
      "id" : "http://id.loc.gov/vocabulary/relators/aut",
      "label" : "Autor/in"
    }
  } ],
  "extent" : "81 S.",
  "hasItem" : [ {
    "id" : "http://lobid.org/items/TT000136775:DE-1156:Sbh%2070%20%2F%20Wal#!",
    "type" : [ "Item" ],
    "heldBy" : {
      "id" : "http://lobid.org/organisations/DE-1156#!",
      "label" : "lobid Organisation"
    },
    "callNumber" : "Sbh 70 / Wal",
    "label" : "Sbh 70 / Wal"
  }, {
    "id" : "http://lobid.org/items/TT000136775:DE-1156:Sbh%2070%20%2F%20Wal%20%2F%20a#!",
    "type" : [ "Item" ],
    "heldBy" : {
      "id" : "http://lobid.org/organisations/DE-1156#!",
      "label" : "lobid Organisation"
    },
    "callNumber" : "Sbh 70 / Wal / a",
    "label" : "Sbh 70 / Wal / a"
  } ],
  "responsibilityStatement" : [ "von Herm. W. v. Waltershausen" ],
  "medium" : [ {
    "id" : "http://rdaregistry.info/termList/RDAproductionMethod/1010",
    "label" : "Print"
  } ],
  "title" : "Dirigenten-Erziehung",
  "hbzId" : "TT000136775",
  "isPartOf" : [ {
    "type" : [ "IsPartOfRelation" ],
    "hasSuperordinate" : [ {
      "id" : "http://lobid.org/resources/TT001211556#!",
      "label" : "Musikpädagogische Bibliothek"
    } ],
    "numbering" : "4"
  } ],
  "publication" : [ {
    "type" : [ "PublicationEvent" ],
    "location" : "Leipzig",
    "publishedBy" : "Quelle & Meyer",
    "startDate" : "1929"
  } ],
  "sameAs" : [ {
    "id" : "http://hub.culturegraph.org/resource/HBZ-TT000136775",
    "label" : "Culturegraph Ressource"
  } ],
  "describedBy" : {
    "id" : "http://lobid.org/resources/TT000136775",
    "type" : [ "BibliographicDescription" ],
    "modifiedBy" : {
      "id" : "http://lobid.org/organisations/DE-605#!",
      "label" : "lobid Organisation"
    },
    "dateCreated" : "19980518",
    "dateModified" : "20180122",
    "inDataset" : {
      "id" : "http://lobid.org/resources/dataset#!",
      "label" : "lobid-resources – Der hbz-Verbundkatalog als Linked Open Data"
    },
    "resultOf" : {
      "type" : [ "CreateAction" ],
      "endTime" : "2023-04-16T04:37:34",
      "instrument" : {
        "id" : "https://github.com/hbz/lobid-resources",
        "type" : [ "SoftwareApplication" ],
        "label" : "Software lobid-resources"
      },
      "object" : {
        "id" : "http://lobid.org/hbz01/TT000136775",
        "type" : [ "DataFeedItem" ],
        "inDataset" : {
          "id" : "https://datahub.io/dataset/hbz_unioncatalog",
          "label" : "hbz_unioncatalog"
        },
        "label" : "hbz-Ressource TT000136775 im Exportformat MAB2-XML"
      }
    },
    "license" : [ {
      "id" : "http://creativecommons.org/publicdomain/zero/1.0",
      "label" : "Creative Commons-Lizenz CC0 1.0 Universal"
    } ],
    "label" : "Webseite der hbz-Ressource TT000136775"
  },
  "@context" : "http://lobid.org/resources/context.jsonld",
  "id" : "http://lobid.org/resources/TT000136775#!"
}