{
  "@context" : "http://lobid.org/resources/context.jsonld",
  "almaMmsId" : "990363553190206441",
  "hbzId" : "HT020163348",
  "title" : "Der Prozess der Berufsorientierung aus der Perspektive der Schülerschaft mit sonderpädagogischem Unterstützungsbedarf im Bereich Lernen an Förderschulen im Land Nordrhein-Westfalen",
  "responsibilityStatement" : [ "vorgelegt von Carina Hübner ; erster Gutachter: Prof. Dr. Rüdiger Kißgen" ],
  "publication" : [ {
    "location" : "Siegen",
    "publicationHistory" : "2019",
    "startDate" : "2019",
    "type" : [ "PublicationEvent" ]
  } ],
  "hasItem" : [ {
    "heldBy" : {
      "id" : "http://lobid.org/organisations/DE-605#!",
      "label" : "lobid Organisation"
    },
    "id" : "https://lobid.org/item/990363553190206441",
    "type" : [ "MBD" ],
    "label" : "990363553190206441"
  } ],
  "type" : [ "Thesis", "Book", "BibliographicResource" ],
  "language" : [ {
    "label" : "Deutsch",
    "id" : "http://id.loc.gov/vocabulary/iso639-2/ger"
  } ],
  "sameAs" : [ {
    "id" : "http://hub.culturegraph.org/resource/HBZ-HT020163348",
    "label" : "Culturegraph Ressource"
  } ],
  "extent" : "272 Seiten : Diagramme, Illustrationen",
  "related" : [ {
    "label" : "Der Prozess der Berufsorientierung aus der Perspektive der Schülerschaft mit sonderpädagogischem Unterstützungsbedarf im Bereich Lernen an Förderschulen im Land Nordrhein-Westfalen",
    "id" : "http://lobid.org/resources/HT020163372#!",
    "note" : "Erscheint auch als Online-Ausgabe, PDF"
  } ],
  "inCollection" : [ {
    "label" : "Nordrhein-Westfälische Bibliographie (NWBib)",
    "id" : "http://lobid.org/resources/HT014176012#!",
    "type" : [ "Collection" ]
  }, {
    "id" : "https://lobid.org/collections#NWBib-6",
    "type" : [ "Collection" ],
    "label" : "collections#NWBib-6"
  } ],
  "contribution" : [ {
    "type" : [ "Contribution" ],
    "agent" : {
      "label" : "Hübner, Carina",
      "type" : [ "Person" ],
      "gndIdentifier" : "1153229838",
      "id" : "https://d-nb.info/gnd/1153229838"
    },
    "role" : {
      "id" : "http://id.loc.gov/vocabulary/relators/aut",
      "label" : "Autor/in"
    }
  }, {
    "type" : [ "Contribution" ],
    "agent" : {
      "label" : "Kißgen, Rüdiger",
      "type" : [ "Person" ],
      "gndIdentifier" : "122065514",
      "id" : "https://d-nb.info/gnd/122065514"
    },
    "role" : {
      "id" : "http://id.loc.gov/vocabulary/relators/dgs",
      "label" : "Akademische Betreuung"
    }
  }, {
    "type" : [ "Contribution" ],
    "agent" : {
      "type" : [ "CorporateBody" ],
      "gndIdentifier" : "64850-4",
      "id" : "https://d-nb.info/gnd/64850-4",
      "label" : "Universität Siegen"
    },
    "role" : {
      "id" : "http://id.loc.gov/vocabulary/relators/dgg",
      "label" : "Grad-verleihende Institution"
    }
  } ],
  "describedBy" : {
    "id" : "http://lobid.org/resources/990363553190206441",
    "label" : "Webseite der hbz-Ressource 990363553190206441",
    "type" : [ "BibliographicDescription" ],
    "inDataset" : {
      "id" : "http://lobid.org/resources/dataset#!",
      "label" : "lobid-resources – Der hbz-Verbundkatalog als Linked Open Data"
    },
    "license" : [ {
      "id" : "http://creativecommons.org/publicdomain/zero/1.0",
      "label" : "Creative Commons-Lizenz CC0 1.0 Universal"
    } ],
    "sourceOrganization" : {
      "id" : "http://lobid.org/organisations/DE-467#!",
      "label" : "lobid Organisation"
    },
    "modifiedBy" : {
      "id" : "http://lobid.org/organisations/DE-6#!",
      "label" : "lobid Organisation"
    },
    "dateModified" : "20210731",
    "dateCreated" : "20210405",
    "resultOf" : {
      "type" : [ "CreateAction" ],
      "instrument" : {
        "id" : "https://github.com/hbz/lobid-resources",
        "type" : [ "SoftwareApplication" ],
        "label" : "Software lobid-resources"
      },
      "object" : {
        "id" : "http://lobid.org/hbz01/990363553190206441",
        "type" : [ "DataFeedItem" ],
        "label" : "hbz-Ressource 990363553190206441 im Exportformat MARC21 XML",
        "inDataset" : {
          "id" : "https://datahub.io/dataset/hbz_unioncatalog",
          "label" : "hbz_unioncatalog"
        }
      },
      "endTime" : "dummy"
    }
  },
  "natureOfContent" : [ {
    "label" : "Hochschulschrift",
    "id" : "http://d-nb.info/gnd/4113937-9"
  } ],
  "subject" : [ {
    "type" : [ "ComplexSubject" ],
    "label" : "Nordrhein-Westfalen | Sonderschule | Berufsorientierung | Lernbehinderter Mensch | Übergang | Arbeitswelt",
    "componentList" : [ {
      "label" : "Nordrhein-Westfalen",
      "type" : [ "PlaceOrGeographicName" ],
      "id" : "http://d-nb.info/gnd/4042570-8",
      "source" : {
        "id" : "https://d-nb.info/gnd/7749153-1",
        "label" : "Gemeinsame Normdatei (GND)"
      },
      "gndIdentifier" : "4042570-8"
    }, {
      "label" : "Sonderschule",
      "type" : [ "SubjectHeading" ],
      "id" : "http://d-nb.info/gnd/4055542-2",
      "source" : {
        "id" : "https://d-nb.info/gnd/7749153-1",
        "label" : "Gemeinsame Normdatei (GND)"
      },
      "gndIdentifier" : "4055542-2"
    }, {
      "label" : "Berufsorientierung",
      "type" : [ "SubjectHeading" ],
      "id" : "http://d-nb.info/gnd/4140124-4",
      "source" : {
        "id" : "https://d-nb.info/gnd/7749153-1",
        "label" : "Gemeinsame Normdatei (GND)"
      },
      "gndIdentifier" : "4140124-4"
    }, {
      "label" : "Lernbehinderter Mensch",
      "type" : [ "SubjectHeading" ],
      "id" : "http://d-nb.info/gnd/4167388-8",
      "source" : {
        "id" : "https://d-nb.info/gnd/7749153-1",
        "label" : "Gemeinsame Normdatei (GND)"
      },
      "gndIdentifier" : "4167388-8"
    }, {
      "label" : "Übergang",
      "type" : [ "SubjectHeading" ],
      "id" : "http://d-nb.info/gnd/4681060-2",
      "source" : {
        "id" : "https://d-nb.info/gnd/7749153-1",
        "label" : "Gemeinsame Normdatei (GND)"
      },
      "gndIdentifier" : "4681060-2"
    }, {
      "label" : "Arbeitswelt",
      "type" : [ "SubjectHeading" ],
      "id" : "http://d-nb.info/gnd/4002805-7",
      "source" : {
        "id" : "https://d-nb.info/gnd/7749153-1",
        "label" : "Gemeinsame Normdatei (GND)"
      },
      "gndIdentifier" : "4002805-7"
    } ]
  } ],
  "subjectAltLabel" : [ "Arbeitsleben", "Berufsleben", "Lernbehinderter Schüler", "Sonderschüler", "Berufliche Orientierung", "Förderschule", "Sonderschulen", "Förderschulen", "Hilfsschule", "Nord-Westphalie", "Norte-Westfalia", "NRW", "North Rhine-Westphalia", "NW", "Noordrijn-Westfalen", "North-Rhine/Westphalia", "Land Nordrhein-Westfalen", "Universitätsstadt Siegen", "Siegen, Universitätsstadt", "Stadt Siegen", "Sigedunum", "Sigena Nassoviae", "Sigena", "Sigena Nassoviorum" ],
  "id" : "http://lobid.org/resources/990363553190206441#!"
}
