{
  "type" : [ "Book", "Image", "BibliographicResource" ],
  "contribution" : [ {
    "type" : [ "Contribution" ],
    "agent" : {
      "id" : "https://d-nb.info/gnd/118521314",
      "type" : [ "Person" ],
      "label" : "Çoban, Ismail",
      "dateOfBirth" : "1945",
      "gndIdentifier" : "118521314"
    },
    "role" : {
      "id" : "http://id.loc.gov/vocabulary/relators/ill",
      "label" : "Illustration"
    }
  }, {
    "type" : [ "Contribution" ],
    "agent" : {
      "id" : "https://d-nb.info/gnd/5150278-1",
      "type" : [ "CorporateBody" ],
      "label" : "Bergkamen. Kulturverwaltung",
      "altLabel" : "Kulturverwaltung. Bergkamen",
      "gndIdentifier" : "5150278-1"
    },
    "role" : {
      "id" : "http://id.loc.gov/vocabulary/relators/ctb",
      "label" : "Beitragende/r"
    }
  }, {
    "type" : [ "Contribution" ],
    "agent" : {
      "id" : "https://d-nb.info/gnd/2052102-9",
      "type" : [ "CorporateBody" ],
      "label" : "Städtische Galerie Sohle 1 (Bergkamen). Kulturverwaltung",
      "altLabel" : [ "Sohle Eins, Multimedia-Galerie", "Städtische Galerie Sohle 1", "Stadtmuseum Bergkamen. Bildergalerie", "Stadtmuseum Bergkamen. Sohle 1, Kommunale Galerie", "Stadtmuseum Bergkamen. Sohle 1, Multimedia-Galerie", "Sohle Eins, Multimedia-Galerie. Bergkamen", "Sohle 1, Kommunale Galerie", "Kommunale Galerie Sohle 1", "Stadtmuseum Bergkamen. Kommunale Galerie", "Sohle Eins, Kommunale Galerie. Bergkamen", "Multimedia-Galerie. Bergkamen", "Sohle 1, Kommunale Galerie. Bergkamen", "Sohle Eins, Kommunale Galerie", "Kommunale Galerie. Bergkamen", "Stadtmuseum Bergkamen. Multimedia-Galerie", "Stadtmuseum Bergkamen. Galerie Sohle 1", "Bildergalerie der Stadt Bergkamen", "Stadtmuseum Bergkamen. Städtische Galerie Sohle 1", "Galerie Sohle 1. Bergkamen", "Bildergalerie Bergkamen" ],
      "gndIdentifier" : "2052102-9"
    },
    "role" : {
      "id" : "http://id.loc.gov/vocabulary/relators/ctb",
      "label" : "Beitragende/r"
    }
  } ],
  "extent" : "53 BL. MIT ZAHLR. ABB. U. TAF., TEILS FARB.",
  "hasItem" : [ {
    "id" : "http://lobid.org/items/TT002494857:DE-Kn3:KMB%2FK%20COBAN,%207%20%201980#!",
    "type" : [ "Item" ],
    "heldBy" : {
      "id" : "http://lobid.org/organisations/DE-Kn3#!",
      "label" : "lobid Organisation"
    },
    "note" : [ "00020050" ],
    "callNumber" : "KMB/K COBAN, 7  1980",
    "label" : "KMB/K COBAN, 7  1980"
  }, {
    "id" : "http://lobid.org/items/TT002494857:DE-6-015:N%20C%20228#!",
    "type" : [ "Item" ],
    "heldBy" : {
      "id" : "http://lobid.org/organisations/DE-6-015#!",
      "label" : "lobid Organisation"
    },
    "callNumber" : "N C 228",
    "label" : "N C 228"
  } ],
  "note" : [ "NE: SOHLE 1 <GALERIE, BERGKAMEN>. - AUSSTELLUNGSKAT." ],
  "medium" : [ {
    "id" : "http://purl.org/lobid/lv#Miscellaneous",
    "label" : "Sonstiges"
  } ],
  "title" : "MALEREI, RADIERUNGEN, HOLZSCHNITTE",
  "hbzId" : "TT002494857",
  "oclcNumber" : [ "1075948907" ],
  "publication" : [ {
    "type" : [ "PublicationEvent" ],
    "location" : "DÜSSELDORF",
    "publishedBy" : "INTERNA-ORB",
    "startDate" : "1980"
  } ],
  "sameAs" : [ {
    "id" : "http://worldcat.org/oclc/1075948907",
    "label" : "1075948907"
  }, {
    "id" : "http://hub.culturegraph.org/resource/HBZ-TT002494857",
    "label" : "Culturegraph Ressource"
  } ],
  "describedBy" : {
    "id" : "http://lobid.org/resources/TT002494857",
    "type" : [ "BibliographicDescription" ],
    "dateCreated" : "20080718",
    "inDataset" : {
      "id" : "http://lobid.org/resources/dataset#!",
      "label" : "lobid-resources – Der hbz-Verbundkatalog als Linked Open Data"
    },
    "resultOf" : {
      "type" : [ "CreateAction" ],
      "endTime" : "2023-04-16T05:16:32",
      "instrument" : {
        "id" : "https://github.com/hbz/lobid-resources",
        "type" : [ "SoftwareApplication" ],
        "label" : "Software lobid-resources"
      },
      "object" : {
        "id" : "http://lobid.org/hbz01/TT002494857",
        "type" : [ "DataFeedItem" ],
        "inDataset" : {
          "id" : "https://datahub.io/dataset/hbz_unioncatalog",
          "label" : "hbz_unioncatalog"
        },
        "label" : "hbz-Ressource TT002494857 im Exportformat MAB2-XML"
      }
    },
    "license" : [ {
      "id" : "http://creativecommons.org/publicdomain/zero/1.0",
      "label" : "Creative Commons-Lizenz CC0 1.0 Universal"
    } ],
    "provider" : {
      "id" : "http://lobid.org/organisations/DE-Kn3#!",
      "label" : "lobid Organisation"
    },
    "sourceOrganization" : {
      "id" : "http://lobid.org/organisations/DE-Kn3#!",
      "label" : "lobid Organisation"
    },
    "label" : "Webseite der hbz-Ressource TT002494857"
  },
  "@context" : "http://lobid.org/resources/context.jsonld",
  "id" : "http://lobid.org/resources/TT002494857#!"
}