{
  "type" : [ "Book", "BibliographicResource" ],
  "contribution" : [ {
    "type" : [ "Contribution" ],
    "agent" : {
      "id" : "https://d-nb.info/gnd/119134764",
      "type" : [ "Person" ],
      "label" : "Gerz, Alfons",
      "dateOfBirth" : "1913",
      "dateOfDeath" : "1995",
      "gndIdentifier" : "119134764"
    },
    "role" : {
      "id" : "http://id.loc.gov/vocabulary/relators/ctb",
      "label" : "Beitragende/r"
    }
  } ],
  "extent" : "312 S. : überw. Ill.",
  "hasItem" : [ {
    "id" : "http://lobid.org/items/HT016791198:DE-Kn41:2012%2F1#!",
    "type" : [ "Item" ],
    "heldBy" : {
      "id" : "http://lobid.org/organisations/DE-Kn41#!",
      "label" : "lobid Organisation"
    },
    "note" : [ "M" ],
    "callNumber" : "2012/1",
    "label" : "2012/1"
  }, {
    "id" : "http://lobid.org/items/HT016791198:DE-Kn41:49618#!",
    "type" : [ "Item" ],
    "heldBy" : {
      "id" : "http://lobid.org/organisations/DE-Kn41#!",
      "label" : "lobid Organisation"
    },
    "note" : [ "M" ],
    "callNumber" : "49618",
    "label" : "49618"
  } ],
  "responsibilityStatement" : [ "Gesamtverantwortung: Alfons Gerz ..." ],
  "language" : [ {
    "id" : "http://id.loc.gov/vocabulary/iso639-2/fra",
    "label" : "Französisch"
  }, {
    "id" : "http://id.loc.gov/vocabulary/iso639-2/ita",
    "label" : "Italienisch"
  }, {
    "id" : "http://id.loc.gov/vocabulary/iso639-2/eng",
    "label" : "Englisch"
  } ],
  "medium" : [ {
    "id" : "http://rdaregistry.info/termList/RDAproductionMethod/1010",
    "label" : "Print"
  } ],
  "title" : "Leichtathletik, Segeln, Radsport, Ski",
  "hbzId" : "HT016791198",
  "isPartOf" : [ {
    "type" : [ "IsPartOfRelation" ],
    "hasSuperordinate" : [ {
      "id" : "http://lobid.org/resources/HT003422154#!",
      "label" : "Sport Gala"
    } ],
    "numbering" : "87"
  } ],
  "oclcNumber" : [ "1074729477" ],
  "publication" : [ {
    "type" : [ "PublicationEvent" ],
    "location" : "München",
    "publishedBy" : "ProSport Verl.",
    "startDate" : "1987"
  } ],
  "sameAs" : [ {
    "id" : "http://worldcat.org/oclc/1074729477",
    "label" : "1074729477"
  }, {
    "id" : "http://hub.culturegraph.org/resource/HBZ-HT016791198",
    "label" : "Culturegraph Ressource"
  } ],
  "describedBy" : {
    "id" : "http://lobid.org/resources/HT016791198",
    "type" : [ "BibliographicDescription" ],
    "modifiedBy" : {
      "id" : "http://lobid.org/organisations/DE-Kn41#!",
      "label" : "lobid Organisation"
    },
    "dateCreated" : "20110425",
    "dateModified" : "20120119",
    "inDataset" : {
      "id" : "http://lobid.org/resources/dataset#!",
      "label" : "lobid-resources – Der hbz-Verbundkatalog als Linked Open Data"
    },
    "resultOf" : {
      "type" : [ "CreateAction" ],
      "endTime" : "2023-04-16T02:21:54",
      "instrument" : {
        "id" : "https://github.com/hbz/lobid-resources",
        "type" : [ "SoftwareApplication" ],
        "label" : "Software lobid-resources"
      },
      "object" : {
        "id" : "http://lobid.org/hbz01/HT016791198",
        "type" : [ "DataFeedItem" ],
        "inDataset" : {
          "id" : "https://datahub.io/dataset/hbz_unioncatalog",
          "label" : "hbz_unioncatalog"
        },
        "label" : "hbz-Ressource HT016791198 im Exportformat MAB2-XML"
      }
    },
    "license" : [ {
      "id" : "http://creativecommons.org/publicdomain/zero/1.0",
      "label" : "Creative Commons-Lizenz CC0 1.0 Universal"
    } ],
    "sourceOrganization" : {
      "id" : "http://lobid.org/organisations/DE-Kn41#!",
      "label" : "lobid Organisation"
    },
    "label" : "Webseite der hbz-Ressource HT016791198"
  },
  "@context" : "http://lobid.org/resources/context.jsonld",
  "id" : "http://lobid.org/resources/HT016791198#!"
}