{
  "@context" : "http://lobid.org/resources/context.jsonld",
  "contribution" : [ {
    "agent" : {
      "altLabel" : [ "Hülshoff, Anna Elisabeth von Droste-", "Deluosite-Xuersihuofu, ...", "Droste-Hülshoff, Anna Elisabeth von", "דרוסטה-הילסהוף, אנטה פון", "Droste-Hülshoff, Anette v.", "Droste-Hülshoff, Annette", "Droste-Hülshoff, Annette Elisabeth, Freiin von", "Von Droste-Hülshoff, Annette Elise", "Hülshoff, Annette von Droste", "Droste zu Hülshoff, Annette von", "Xuersihuofu, ... Deluosite-", "Droste, Annette", "Hülshoff, ... Droste-", "Hülshof, Annette von Droste-", "Droste-Hülshof, Annette von", "Hülshoff, Anette v. Droste-", "Droste-Hülshof, Annette, Freiin von", "Hülshoff, Anna Elisabeth Franziska Adolphine Wilhelmine Louise Maria von Droste zu", "Hülshoff, Anette von Droste-", "Droste-Hülshoff, A. von", "Droste-Hülshoff, Annette E. von", "Droste-Hülshoff, Anette von", "Droste zu Hülshoff, Elisabeth Anna", "Hülshoff, Anna Elisabeth v. Droste-", "Droste, ...", "Hülshoff, Annette von Droste-", "드로스테-휠스호프, 아네테 폰", "Hülshoff, Elisabeth Anna Droste zu", "Hülshoff, Annette Elisabeth Freiin von Droste-", "Droste-Huelshoff, Annette Elise von", "Hülshoff, A. von Droste-", "Droste Hülshoff, Annette von", "Droste-Hülshoff, ...", "Droste zu Hülshoff, Anna Elisabeth", "Droste-Huelshoff, Annette von", "Hülshoff, Anna Elisabeth Droste zu", "Von Droste-Hülshoff, Annette", "Droste zu Hülshoff, Anna Elisabeth Franziska Adolphine Wilhelmine Louise Maria von", "D.-H., Annette Elisabeth v.", "Hülshoff, Annette v. Droste-", "Droste zu Hülshoff, Anna Elisabeth Franzisca Adolphina Wilhelmina Ludovica", "Droste zu Hülshoff, Anna Elisabeth Francisca Maria Adolphina Wilhelmina Ludovica von", "Droste, Annette von", "Droste-Hülshoff, Anna Elisabeth v.", "Hyurusuhofu, ... Dorosute-", "Von Droste-Hülshoff, Anna Elisabeth", "Hülshoff, Annette von Droste zu", "Huelshoff, Annette von Droste-", "Droste-Hülshoff, Annette Freiin von", "Droste-Hülshoff, Annette v." ],
      "dateOfBirth" : "1797",
      "dateOfDeath" : "1848",
      "id" : "http://d-nb.info/gnd/118527533",
      "label" : "Droste-Hülshoff, Annette von",
      "type" : [ "Person" ]
    },
    "role" : {
      "id" : "http://id.loc.gov/vocabulary/relators/cre",
      "label" : "Autor/in"
    },
    "type" : [ "Contribution" ]
  }, {
    "agent" : {
      "altLabel" : [ "Hirsch, Karl Georg", "Hirsch, Karl-Georg (Künstler)" ],
      "dateOfBirth" : "1938",
      "gndIdentifier" : "118705172",
      "id" : "http://d-nb.info/gnd/118705172",
      "label" : "Hirsch, Karl-Georg",
      "source" : {
        "id" : "http://d-nb.info/gnd/7749153-1",
        "label" : "Gemeinsame Normdatei (GND)"
      },
      "type" : [ "Person" ]
    },
    "role" : {
      "id" : "http://id.loc.gov/vocabulary/relators/ill",
      "label" : "Illustration"
    },
    "type" : [ "Contribution" ]
  } ],
  "describedBy" : {
    "dateCreated" : "19970502",
    "id" : "http://lobid.org/resources/HT007331917",
    "inDataset" : {
      "id" : "http://lobid.org/resources/dataset#!",
      "label" : "lobid-resources – Der hbz-Verbundkatalog als Linked Open Data"
    },
    "label" : "Webseite der hbz-Ressource HT007331917",
    "resultOf" : {
      "endTime" : "0001-01-01T00:00:00",
      "instrument" : {
        "id" : "https://github.com/hbz/lobid-resources",
        "label" : "Software lobid-resources",
        "type" : [ "SoftwareApplication" ]
      },
      "object" : {
        "id" : "http://lobid.org/hbz01/HT007331917",
        "isPartOf" : [ {
          "id" : "https://datahub.io/dataset/hbz_unioncatalog",
          "label" : "https://datahub.io/dataset"
        } ],
        "label" : "hbz-Ressource HT007331917 im Exportformat MAB2-XML",
        "type" : [ "DataFeedItem" ]
      },
      "type" : [ "CreateAction" ]
    },
    "sourceOrganization" : {
      "id" : "http://lobid.org/organisations/DE-836#!",
      "label" : "lobid Organisation"
    },
    "type" : [ "BibliographicDescription" ]
  },
  "extent" : "89 S. : Ill.",
  "hasItem" : [ {
    "callNumber" : "AQSH 1",
    "describedBy" : {
      "id" : "http://lobid.org/items/HT007331917:DE-836:AQSH%201",
      "label" : "lobid Bestandsressource"
    },
    "heldBy" : {
      "id" : "http://lobid.org/organisations/DE-836",
      "label" : "lobid Organisation"
    },
    "id" : "http://lobid.org/items/HT007331917:DE-836:AQSH%201#!",
    "itemOf" : {
      "id" : "http://lobid.org/resources/HT007331917#!",
      "label" : "lobid Ressource"
    },
    "label" : "AQSH 1",
    "note" : "00007007",
    "type" : [ "Item" ]
  } ],
  "hbzId" : "HT007331917",
  "id" : "http://lobid.org/resources/HT007331917#!",
  "isbn" : [ "9783922406662", "3922406661" ],
  "medium" : [ {
    "id" : "http://rdaregistry.info/termList/RDAproductionMethod/1010",
    "label" : "Print"
  } ],
  "publication" : [ {
    "location" : "Memmingen",
    "publishedBy" : "Visel",
    "startDate" : "1996",
    "type" : [ "PublicationEvent" ]
  } ],
  "responsibilityStatement" : [ "Annette von Droste-Hülshoff. Holzstiche von Karl-Georg Hirsch" ],
  "sameAs" : [ {
    "id" : "http://hub.culturegraph.org/resource/HBZ-HT007331917",
    "label" : "Culturegraph Ressource"
  } ],
  "subject" : [ {
    "componentList" : [ {
      "altLabel" : [ "Hirsch, Karl Georg", "Hirsch, Karl-Georg (Künstler)" ],
      "dateOfBirth" : "1938",
      "gndIdentifier" : "118705172",
      "id" : "http://d-nb.info/gnd/118705172",
      "label" : "Hirsch, Karl-Georg",
      "source" : {
        "id" : "http://d-nb.info/gnd/7749153-1",
        "label" : "Gemeinsame Normdatei (GND)"
      },
      "type" : [ "Person" ]
    }, {
      "gndIdentifier" : "4123412-1",
      "id" : "http://d-nb.info/gnd/4123412-1",
      "label" : "Illustration",
      "source" : {
        "id" : "http://d-nb.info/gnd/7749153-1",
        "label" : "Gemeinsame Normdatei (GND)"
      },
      "type" : [ "SubjectHeading" ]
    }, {
      "gndIdentifier" : "4125166-0",
      "id" : "http://d-nb.info/gnd/4125166-0",
      "label" : "Holzstich",
      "source" : {
        "id" : "http://d-nb.info/gnd/7749153-1",
        "label" : "Gemeinsame Normdatei (GND)"
      },
      "type" : [ "SubjectHeading" ]
    }, {
      "gndIdentifier" : "4113356-0",
      "id" : "http://d-nb.info/gnd/4113356-0",
      "label" : "Droste-Hülshoff, Annette von: Die Judenbuche",
      "source" : {
        "id" : "http://d-nb.info/gnd/7749153-1",
        "label" : "Gemeinsame Normdatei (GND)"
      },
      "type" : [ "Work" ]
    } ],
    "label" : "Hirsch, Karl-Georg | Illustration | Holzstich | Droste-Hülshoff, Annette von: Die Judenbuche  ",
    "type" : [ "ComplexSubject" ]
  }, {
    "componentList" : [ {
      "gndIdentifier" : "123456789",
      "id" : "http://d-nb.info/gnd/123456789",
      "label" : "Mustermann, Max: Werk XY",
      "source" : {
        "id" : "http://d-nb.info/gnd/7749153-1",
        "label" : "Gemeinsame Normdatei (GND)"
      },
      "type" : [ "Work" ]
    } ],
    "label" : "Mustermann, Max: Werk XY",
    "type" : [ "ComplexSubject" ]
  } ],
  "subjectAltLabel" : [ "Buchillustrationen", "Buch / Illustration", "Buchillustration", "Hirsch, Karl Georg (1938-)", "Wissenschaftliche Illustration", "Bildmaterial (Buchkunst)", "Tonstich", "Xylographie", "Holzstiche", "Xylografie", "Illustrationen", "Abbildung (Buchkunst)", "Bebilderung", "Hirsch, Karl-Georg (Künstler) (1938-)" ],
  "title" : "Die Judenbuche",
  "type" : [ "BibliographicResource", "Book" ]
}