{
  "type" : [ "Book", "BibliographicResource" ],
  "contribution" : [ {
    "type" : [ "Contribution" ],
    "agent" : {
      "id" : "https://d-nb.info/gnd/118839055",
      "type" : [ "Person" ],
      "label" : "Wedgwood, Cicely V.",
      "altLabel" : [ "Wedgwood, Veronica", "Wedgwood, Cicely Veronica", "Wedgwood, C. V." ],
      "dateOfBirth" : "1910",
      "dateOfDeath" : "1997",
      "gndIdentifier" : "118839055"
    },
    "role" : {
      "id" : "http://id.loc.gov/vocabulary/relators/aut",
      "label" : "Autor/in"
    }
  } ],
  "extent" : "23 p.",
  "responsibilityStatement" : [ "by C[icely] V[eronica] Wedgwood" ],
  "medium" : [ {
    "id" : "http://rdaregistry.info/termList/RDAproductionMethod/1010",
    "label" : "Print"
  } ],
  "title" : "The Common man in the great Civil War",
  "hbzId" : "HT010662586",
  "publication" : [ {
    "type" : [ "PublicationEvent" ],
    "publishedBy" : "Leicester Univ. Pr.",
    "startDate" : "1957"
  } ],
  "sameAs" : [ {
    "id" : "http://hub.culturegraph.org/resource/HBZ-HT010662586",
    "label" : "Culturegraph Ressource"
  } ],
  "describedBy" : {
    "id" : "http://lobid.org/resources/HT010662586",
    "type" : [ "BibliographicDescription" ],
    "dateCreated" : "19990818",
    "inDataset" : {
      "id" : "http://lobid.org/resources/dataset#!",
      "label" : "lobid-resources – Der hbz-Verbundkatalog als Linked Open Data"
    },
    "resultOf" : {
      "type" : [ "CreateAction" ],
      "endTime" : "2023-04-16T01:04:38",
      "instrument" : {
        "id" : "https://github.com/hbz/lobid-resources",
        "type" : [ "SoftwareApplication" ],
        "label" : "Software lobid-resources"
      },
      "object" : {
        "id" : "http://lobid.org/hbz01/HT010662586",
        "type" : [ "DataFeedItem" ],
        "inDataset" : {
          "id" : "https://datahub.io/dataset/hbz_unioncatalog",
          "label" : "hbz_unioncatalog"
        },
        "label" : "hbz-Ressource HT010662586 im Exportformat MAB2-XML"
      }
    },
    "license" : [ {
      "id" : "http://creativecommons.org/publicdomain/zero/1.0",
      "label" : "Creative Commons-Lizenz CC0 1.0 Universal"
    } ],
    "sourceOrganization" : {
      "id" : "http://lobid.org/organisations/DE-605#!",
      "label" : "lobid Organisation"
    },
    "label" : "Webseite der hbz-Ressource HT010662586"
  },
  "@context" : "http://lobid.org/resources/context.jsonld",
  "id" : "http://lobid.org/resources/HT010662586#!"
}