{
  "@context" : "http://lobid.org/resources/context.jsonld",
  "id" : "http://lobid.org/resources/990366624790206441#!",
  "type" : [ "BibliographicResource", "Book" ],
  "medium" : [ {
    "label" : "Datenträger",
    "id" : "http://rdaregistry.info/termList/RDAMediaType/1003"
  }, {
    "label" : "Online-Ressource",
    "id" : "http://rdaregistry.info/termList/RDACarrierType/1018"
  } ],
  "title" : "Der Anti-Bias-Ansatz",
  "almaMmsId" : "990366624790206441",
  "hbzId" : "HT020469610",
  "deprecatedUri" : "http://lobid.org/resources/HT020469610#!",
  "isbn" : [ "9783531922089", "3531922084" ],
  "otherTitleInformation" : [ "Zu Konzept und Praxis einer Pädagogik für den Umgang mit (kultureller) Vielfalt" ],
  "publication" : [ {
    "startDate" : "2010",
    "type" : [ "PublicationEvent" ],
    "location" : [ "Wiesbaden" ],
    "publishedBy" : [ "VS Verlag fur Sozialwissenschaften GmbH" ]
  } ],
  "describedBy" : {
    "id" : "http://lobid.org/resources/990366624790206441",
    "label" : "Webseite der hbz-Ressource 990366624790206441",
    "type" : [ "BibliographicDescription" ],
    "inDataset" : {
      "id" : "http://lobid.org/resources/dataset#!",
      "label" : "lobid-resources – Der hbz-Verbundkatalog als Linked Open Data"
    },
    "resultOf" : {
      "type" : [ "CreateAction" ],
      "endTime" : "0000-00-00T00:00:00",
      "instrument" : {
        "id" : "https://github.com/hbz/lobid-resources",
        "type" : [ "SoftwareApplication" ],
        "label" : "Software lobid-resources"
      },
      "object" : {
        "id" : "https://lobid.org/marcxml/990366624790206441",
        "dateCreated" : "2021-04-06",
        "dateModified" : "2022-11-09",
        "type" : [ "DataFeedItem" ],
        "label" : "hbz-Ressource 990366624790206441 im Exportformat MARC21 XML",
        "inDataset" : {
          "id" : "https://datahub.io/dataset/hbz_unioncatalog",
          "label" : "hbz_unioncatalog"
        },
        "sourceOrganization" : {
          "id" : "http://lobid.org/organisations/DE-Hag4#!",
          "label" : "Fachhochschule Südwestfalen, Fachbibliothek Hagen, Zentralbibliothek"
        },
        "provider" : {
          "id" : "http://lobid.org/organisations/DE-605#!",
          "label" : "hbz - Hochschulbibliothekszentrum des Landes Nordrhein-Westfalen"
        },
        "modifiedBy" : [ {
          "id" : "http://lobid.org/organisations/DE-575#!",
          "label" : "Hochschule für Musik Detmold, Bibliothek"
        }, {
          "id" : "http://lobid.org/organisations/DE-605#!",
          "label" : "hbz - Hochschulbibliothekszentrum des Landes Nordrhein-Westfalen"
        } ]
      }
    },
    "license" : [ {
      "id" : "http://creativecommons.org/publicdomain/zero/1.0",
      "label" : "Creative Commons-Lizenz CC0 1.0 Universal"
    } ]
  },
  "sameAs" : [ {
    "id" : "https://hub.culturegraph.org/resource/(DE-605)990366624790206441",
    "label" : "Culturegraph Ressource"
  } ],
  "related" : [ {
    "note" : [ "Druck-Ausgabe" ],
    "isbn" : [ "9783531171333", "353117133X" ]
  } ],
  "inCollection" : [ {
    "id" : "http://lobid.org/organisations/DE-655#!",
    "label" : "hbz - Hochschulbibliothekszentrum des Landes Nordrhein-Westfalen, Netzwerkzone",
    "type" : [ "Collection" ]
  }, {
    "id" : "http://lobid.org/organisations/ZDB-30-PQE#!",
    "label" : "ProQuest Ebook Central",
    "type" : [ "Collection" ]
  } ],
  "language" : [ {
    "id" : "http://id.loc.gov/vocabulary/iso639-2/ger",
    "label" : "Deutsch"
  } ],
  "extent" : "1 Online-Ressource (230 Seiten)",
  "hasItem" : [ {
    "type" : [ "Item", "DigitalDocument" ],
    "label" : "Electronic Portfolio",
    "electronicLocator" : "https://eu04.alma.exlibrisgroup.com/view/uresolver/49HBZ_FSW/openurl?u.ignore_date_coverage=true&portfolio_pid=5378132900006461&Force_direct=true",
    "sublocation" : "https://hbz-network.userservices.exlibrisgroup.com/view/uresolver/49HBZ_FSW/openurl?u.ignore_date_coverage=true&rft.mms_id=990012937280106461",
    "heldBy" : {
      "isil" : "DE-Hag4",
      "id" : "http://lobid.org/organisations/DE-Hag4#!",
      "label" : "Fachhochschule Südwestfalen, Fachbibliothek Hagen, Zentralbibliothek"
    },
    "seeAlso" : [ "https://kai.fh-swf.de/permalink/49HBZ_FSW/ou32r9/alma990366624790206441" ],
    "inCollection" : [ {
      "id" : "http://lobid.org/organisations/DE-Hag4#!",
      "label" : "Fachhochschule Südwestfalen, Fachbibliothek Hagen, Zentralbibliothek"
    } ],
    "id" : "http://lobid.org/items/990366624790206441:DE-Hag4:5378132900006461#!"
  }, {
    "type" : [ "Item", "DigitalDocument" ],
    "label" : "Electronic Portfolio",
    "electronicLocator" : "https://eu04.alma.exlibrisgroup.com/view/uresolver/49HBZ_DET/openurl?u.ignore_date_coverage=true&portfolio_pid=53102917670006480&Force_direct=true",
    "sublocation" : "https://hbz-network.userservices.exlibrisgroup.com/view/uresolver/49HBZ_DET/openurl?u.ignore_date_coverage=true&rft.mms_id=991006843529706480",
    "heldBy" : {
      "isil" : "DE-575",
      "id" : "http://lobid.org/organisations/DE-575#!",
      "label" : "Hochschule für Musik Detmold, Bibliothek"
    },
    "seeAlso" : [ "https://det.digibib.net/search/katalog/record/(DE-605)HT020469610" ],
    "inCollection" : [ {
      "id" : "http://lobid.org/organisations/DE-51#!",
      "label" : "Lippische Landesbibliothek - Theologische Bibliothek und Mediothek"
    } ],
    "id" : "http://lobid.org/items/990366624790206441:DE-575:53102917670006480#!"
  } ],
  "bibliographicLevel" : {
    "label" : "Monograph/Item",
    "id" : "https://www.loc.gov/marc/bibliographic/bdleader.html#Monograph_Item"
  },
  "responsibilityStatement" : [ "Katja Gramelt" ],
  "contribution" : [ {
    "agent" : {
      "gndIdentifier" : "140303286",
      "id" : "https://d-nb.info/gnd/140303286",
      "label" : "Gramelt, Katja",
      "type" : [ "Person" ]
    },
    "role" : {
      "id" : "http://id.loc.gov/vocabulary/relators/aut",
      "label" : "Autor/in"
    },
    "type" : [ "Contribution" ]
  } ]
}
