{
  "@context" : "http://lobid.org/resources/context.jsonld",
  "almaMmsId" : "990364897030206441",
  "hbzId" : "HT020297152",
  "title" : "Die Erfindung des Rockkonzerts in der Provinz",
  "otherTitleInformation" : [ "ein praxeologischer Blick auf das Soester \"Karussell der Jugend\" 1959-1971" ],
  "responsibilityStatement" : [ "Peter Klose" ],
  "publication" : [ {
    "publicationHistory" : "2019",
    "startDate" : "2019",
    "type" : [ "PublicationEvent" ]
  } ],
  "hasItem" : [ {
    "heldBy" : {
      "id" : "http://lobid.org/organisations/DE-605#!",
      "label" : "lobid Organisation"
    },
    "id" : "https://lobid.org/item/990364897030206441",
    "type" : [ "MBD" ],
    "label" : "990364897030206441"
  } ],
  "type" : [ "Book", "BibliographicResource" ],
  "language" : [ {
    "label" : "Deutsch",
    "id" : "http://id.loc.gov/vocabulary/iso639-2/ger"
  } ],
  "sameAs" : [ {
    "id" : "http://hub.culturegraph.org/resource/HBZ-HT020297152",
    "label" : "Culturegraph Ressource"
  } ],
  "extent" : "Illustrationen, Diagramm",
  "isPartOf" : [ {
    "type" : "IsPartOfRelation",
    "hasSuperordinate" : [ {
      "label" : "(Dis-)Orienting Sounds / Ralf von Appen, Mario Dunkel (Hg.)",
      "id" : "http://lobid.org/resources/HT020255346#!"
    } ]
  } ],
  "inCollection" : [ {
    "label" : "Nordrhein-Westfälische Bibliographie (NWBib)",
    "id" : "http://lobid.org/resources/HT014176012#!",
    "type" : [ "Collection" ]
  }, {
    "id" : "https://lobid.org/collections#NWBib-6",
    "type" : [ "Collection" ],
    "label" : "collections#NWBib-6"
  } ],
  "contribution" : [ {
    "type" : [ "Contribution" ],
    "agent" : {
      "label" : "Klose, Peter",
      "type" : [ "Person" ],
      "gndIdentifier" : "135325900",
      "id" : "https://d-nb.info/gnd/135325900"
    },
    "role" : {
      "id" : "http://id.loc.gov/vocabulary/relators/aut",
      "label" : "Autor/in"
    }
  } ],
  "describedBy" : {
    "id" : "http://lobid.org/resources/990364897030206441",
    "label" : "Webseite der hbz-Ressource 990364897030206441",
    "type" : [ "BibliographicDescription" ],
    "inDataset" : {
      "id" : "http://lobid.org/resources/dataset#!",
      "label" : "lobid-resources – Der hbz-Verbundkatalog als Linked Open Data"
    },
    "license" : [ {
      "id" : "http://creativecommons.org/publicdomain/zero/1.0",
      "label" : "Creative Commons-Lizenz CC0 1.0 Universal"
    } ],
    "sourceOrganization" : {
      "id" : "http://lobid.org/organisations/DE-6#!",
      "label" : "lobid Organisation"
    },
    "dateModified" : "20210409",
    "dateCreated" : "20210405",
    "resultOf" : {
      "type" : [ "CreateAction" ],
      "instrument" : {
        "id" : "https://github.com/hbz/lobid-resources",
        "type" : [ "SoftwareApplication" ],
        "label" : "Software lobid-resources"
      },
      "object" : {
        "id" : "http://lobid.org/hbz01/990364897030206441",
        "type" : [ "DataFeedItem" ],
        "label" : "hbz-Ressource 990364897030206441 im Exportformat MARC21 XML",
        "inDataset" : {
          "id" : "https://datahub.io/dataset/hbz_unioncatalog",
          "label" : "hbz_unioncatalog"
        }
      },
      "endTime" : "dummy"
    }
  },
  "subject" : [ {
    "type" : [ "ComplexSubject" ],
    "label" : "Karussell der Jugend | Geschichte 1959-1971",
    "componentList" : [ {
      "label" : "Karussell der Jugend",
      "type" : [ "ConferenceOrEvent" ],
      "id" : "http://d-nb.info/gnd/1200563662",
      "source" : {
        "id" : "https://d-nb.info/gnd/7749153-1",
        "label" : "Gemeinsame Normdatei (GND)"
      },
      "gndIdentifier" : "1200563662"
    }, {
      "label" : "Geschichte 1959-1971"
    } ]
  }, {
    "type" : [ "ComplexSubject" ],
    "label" : "Allerheiligenkirmes | Jugend | Tanzveranstaltung | Geschichte 1959-1971",
    "componentList" : [ {
      "label" : "Allerheiligenkirmes",
      "type" : [ "ConferenceOrEvent" ],
      "id" : "http://d-nb.info/gnd/7677592-6",
      "source" : {
        "id" : "https://d-nb.info/gnd/7749153-1",
        "label" : "Gemeinsame Normdatei (GND)"
      },
      "gndIdentifier" : "7677592-6"
    }, {
      "label" : "Jugend",
      "type" : [ "SubjectHeading" ],
      "id" : "http://d-nb.info/gnd/4028859-6",
      "source" : {
        "id" : "https://d-nb.info/gnd/7749153-1",
        "label" : "Gemeinsame Normdatei (GND)"
      },
      "gndIdentifier" : "4028859-6"
    }, {
      "label" : "Tanzveranstaltung",
      "type" : [ "SubjectHeading" ],
      "id" : "http://d-nb.info/gnd/4184453-1",
      "source" : {
        "id" : "https://d-nb.info/gnd/7749153-1",
        "label" : "Gemeinsame Normdatei (GND)"
      },
      "gndIdentifier" : "4184453-1"
    }, {
      "label" : "Geschichte 1959-1971"
    } ]
  } ],
  "subjectAltLabel" : [ "Tanz", "Jugend", "12-20 Jahre", "Jugendalter", "Jugendlicher", "Teenager" ],
  "id" : "http://lobid.org/resources/990364897030206441#!"
}
