{
  "@context" : "http://lobid.org/resources/context.jsonld",
  "almaMmsId" : "990155895060206441",
  "hbzId" : "HT014997977",
  "title" : "Leitfaden für die Behandlung von Ausbauasphalt und Straßenaufbruch mit teer-/pechtypischen Bestandteilen",
  "otherTitleInformation" : [ "Leitfaden für den Geschäftsbereich des Landesbetriebes Straßen und Verkehr" ],
  "responsibilityStatement" : [ "Arbeitskreis Straßenbauabfälle Rheinland-Pfalz; Landesamt für Umweltschutz und Gewerbeaufsicht; Landesbetrieb Straßen und Verkehr Rheinland-Pfalz" ],
  "edition" : [ "1. Aufl." ],
  "publication" : [ {
    "location" : "[Mainz]",
    "publicationHistory" : "2003",
    "startDate" : "2003",
    "type" : [ "PublicationEvent" ]
  } ],
  "hasItem" : [ {
    "heldBy" : {
      "id" : "http://lobid.org/organisations/DE-605#!",
      "label" : "lobid Organisation"
    },
    "id" : "https://lobid.org/item/990155895060206441",
    "type" : [ "MBD" ],
    "label" : "990155895060206441"
  } ],
  "medium" : [ {
    "id" : "http://rdaregistry.info/termList/RDAMediaType/1003",
    "label" : "Datenträger"
  }, {
    "id" : "http://rdaregistry.info/termList/RDACarrierType/1018",
    "label" : "Online-Ressource"
  } ],
  "type" : [ "Book", "BibliographicResource" ],
  "language" : [ {
    "label" : "Deutsch",
    "id" : "http://id.loc.gov/vocabulary/iso639-2/ger"
  } ],
  "sameAs" : [ {
    "id" : "http://hub.culturegraph.org/resource/HBZ-HT014997977",
    "label" : "Culturegraph Ressource"
  } ],
  "extent" : "15, [14] S. : graph. Darst.",
  "inCollection" : [ {
    "id" : "https://lobid.org/collections#929: edoweb",
    "type" : [ "Collection" ],
    "label" : "collections#929: edoweb"
  } ],
  "contribution" : [ {
    "type" : [ "Contribution" ],
    "agent" : {
      "type" : [ "CorporateBody" ],
      "gndIdentifier" : "3062366-2",
      "id" : "https://d-nb.info/gnd/3062366-2",
      "label" : "Arbeitskreis Straßenbauabfälle Rheinland-Pfalz"
    },
    "role" : {
      "id" : "http://id.loc.gov/vocabulary/relators/oth",
      "label" : "Sonstige"
    }
  }, {
    "type" : [ "Contribution" ],
    "agent" : {
      "type" : [ "CorporateBody" ],
      "gndIdentifier" : "10048424-4",
      "id" : "https://d-nb.info/gnd/10048424-4",
      "label" : "Landesbetrieb Straßen und Verkehr Rheinland-Pfalz"
    },
    "role" : {
      "id" : "http://id.loc.gov/vocabulary/relators/oth",
      "label" : "Sonstige"
    }
  }, {
    "type" : [ "Contribution" ],
    "agent" : {
      "type" : [ "CorporateBody" ],
      "gndIdentifier" : "2092393-4",
      "id" : "https://d-nb.info/gnd/2092393-4",
      "label" : "Rheinland-Pfalz. Landesamt für Umweltschutz und Gewerbeaufsicht"
    },
    "role" : {
      "id" : "http://id.loc.gov/vocabulary/relators/oth",
      "label" : "Sonstige"
    }
  } ],
  "describedBy" : {
    "id" : "http://lobid.org/resources/990155895060206441",
    "label" : "Webseite der hbz-Ressource 990155895060206441",
    "type" : [ "BibliographicDescription" ],
    "inDataset" : {
      "id" : "http://lobid.org/resources/dataset#!",
      "label" : "lobid-resources – Der hbz-Verbundkatalog als Linked Open Data"
    },
    "license" : [ {
      "id" : "http://creativecommons.org/publicdomain/zero/1.0",
      "label" : "Creative Commons-Lizenz CC0 1.0 Universal"
    } ],
    "sourceOrganization" : {
      "id" : "http://lobid.org/organisations/DE-929#!",
      "label" : "lobid Organisation"
    },
    "dateModified" : "20210408",
    "dateCreated" : "20210406",
    "resultOf" : {
      "type" : [ "CreateAction" ],
      "instrument" : {
        "id" : "https://github.com/hbz/lobid-resources",
        "type" : [ "SoftwareApplication" ],
        "label" : "Software lobid-resources"
      },
      "object" : {
        "id" : "http://lobid.org/hbz01/990155895060206441",
        "type" : [ "DataFeedItem" ],
        "label" : "hbz-Ressource 990155895060206441 im Exportformat MARC21 XML",
        "inDataset" : {
          "id" : "https://datahub.io/dataset/hbz_unioncatalog",
          "label" : "hbz_unioncatalog"
        }
      },
      "endTime" : "dummy"
    }
  },
  "subject" : [ {
    "notation" : "380",
    "label" : "Handel, Kommunikation, Verkehr",
    "source" : {
      "id" : "http://d-nb.info/gnd/4149423-4",
      "label" : "Dewey-Dezimalklassifikation"
    }
  } ],
  "id" : "http://lobid.org/resources/990155895060206441#!"
}
