{
  "type" : [ "BibliographicResource", "Book" ],
  "contribution" : [ {
    "type" : [ "Contribution" ],
    "agent" : {
      "id" : "https://d-nb.info/gnd/119057603",
      "type" : [ "Person" ],
      "label" : "Steck, Odil Hannes",
      "altLabel" : [ "Steck, Odil", "Steck, O. H.", "Steck, Odil H." ],
      "dateOfBirth" : "1935",
      "dateOfDeath" : "2001",
      "gndIdentifier" : "119057603"
    },
    "role" : {
      "id" : "http://id.loc.gov/vocabulary/relators/aut",
      "label" : "Autor/in"
    }
  } ],
  "extent" : "83 S.",
  "responsibilityStatement" : [ "Odil Hannes Steck" ],
  "language" : [ {
    "id" : "http://id.loc.gov/vocabulary/iso639-2/deu",
    "label" : "Deutsch"
  } ],
  "medium" : [ {
    "id" : "http://purl.org/lobid/lv#Miscellaneous",
    "label" : "Sonstige"
  } ],
  "subject" : [ {
    "type" : [ "ComplexSubject" ],
    "componentList" : [ {
      "id" : "https://d-nb.info/gnd/4028593-5",
      "type" : [ "Work" ],
      "source" : {
        "id" : "https://d-nb.info/gnd/7749153-1",
        "label" : "Gemeinsame Normdatei (GND)"
      },
      "label" : "Bibel. Jesaja",
      "gndIdentifier" : "4028593-5"
    }, {
      "id" : "https://d-nb.info/gnd/4049716-1",
      "type" : [ "SubjectHeading" ],
      "source" : {
        "id" : "https://d-nb.info/gnd/7749153-1",
        "label" : "Gemeinsame Normdatei (GND)"
      },
      "label" : "Rezeption",
      "gndIdentifier" : "4049716-1"
    }, {
      "id" : "https://d-nb.info/gnd/4539193-2",
      "type" : [ "Work" ],
      "source" : {
        "id" : "https://d-nb.info/gnd/7749153-1",
        "label" : "Gemeinsame Normdatei (GND)"
      },
      "label" : "Jesajarolle, Qumrantexte",
      "gndIdentifier" : "4539193-2"
    } ],
    "label" : "Bibel. Jesaja | Rezeption | Qumrantexte: Jesajarolle"
  }, {
    "type" : [ "ComplexSubject" ],
    "componentList" : [ {
      "id" : "https://d-nb.info/gnd/4539193-2",
      "type" : [ "Work" ],
      "source" : {
        "id" : "https://d-nb.info/gnd/7749153-1",
        "label" : "Gemeinsame Normdatei (GND)"
      },
      "label" : "Jesajarolle, Qumrantexte",
      "gndIdentifier" : "4539193-2"
    }, {
      "type" : [ "SubjectHeading" ],
      "label" : "Quelle"
    } ],
    "label" : "Qumrantexte: Jesajarolle | Quelle"
  } ],
  "title" : "Die erste Jesajarolle von Qumran (1QIs a), 2: Textheft",
  "hbzId" : "HT008359420",
  "isPartOf" : [ {
    "type" : [ "IsPartOfRelation" ],
    "hasSuperordinate" : [ {
      "id" : "http://lobid.org/resources/HT008359395#!",
      "label" : "lobid Ressource"
    } ],
    "numbering" : "2"
  } ],
  "subjectAltLabel" : [ "Jerusalem / 1QIsª", "Fortwirken", "Aneignung (Rezeption)", "Nachwirkung (Rezeption)", "Nachleben", "Wirkungsgeschichte" ],
  "publication" : [ {
    "type" : [ "PublicationEvent" ],
    "location" : "Stuttgart",
    "publishedBy" : "Verl. Kath. Bibelwerk",
    "startDate" : "1998"
  } ],
  "sameAs" : [ {
    "id" : "http://hub.culturegraph.org/resource/HBZ-HT008359420",
    "label" : "Culturegraph Ressource"
  } ],
  "describedBy" : {
    "id" : "http://lobid.org/resources/HT008359420",
    "type" : [ "BibliographicDescription" ],
    "dateCreated" : "19980422",
    "inDataset" : {
      "id" : "http://lobid.org/resources/dataset#!",
      "label" : "lobid-resources – Der hbz-Verbundkatalog als Linked Open Data"
    },
    "resultOf" : {
      "type" : [ "CreateAction" ],
      "endTime" : "0001-01-01T00:00:00",
      "instrument" : {
        "id" : "https://github.com/hbz/lobid-resources",
        "type" : [ "SoftwareApplication" ],
        "label" : "Software lobid-resources"
      },
      "object" : {
        "id" : "http://lobid.org/hbz01/HT008359420",
        "type" : [ "DataFeedItem" ],
        "inDataset" : {
          "id" : "https://datahub.io/dataset/hbz_unioncatalog",
          "label" : "hbz_unioncatalog"
        },
        "label" : "hbz-Ressource HT008359420 im Exportformat MAB2-XML"
      }
    },
    "license" : [ {
      "id" : "http://creativecommons.org/publicdomain/zero/1.0",
      "label" : "Creative Commons-Lizenz CC0 1.0 Universal"
    } ],
    "sourceOrganization" : {
      "id" : "http://lobid.org/organisations/DE-292#!",
      "label" : "lobid Organisation"
    },
    "label" : "Webseite der hbz-Ressource HT008359420"
  },
  "@context" : "http://lobid.org/resources/context.jsonld",
  "id" : "http://lobid.org/resources/HT008359420#!"
}